17957725556923028,17841401871496039,360radioco,"360 Radio Colombia","@linacarvajall, creadora de contenido, entrevistó a una persona que trabaja vendiendo bebidas energéticas. Le preguntó si le gustaría ser modelo por un día, ella aceptó y todo quedó registrado en video.",0,"02/23/2026 10:16",https://www.instagram.com/reel/DVHDD5yDtk2/,"Reel de Instagram",,Total,10112,5856,401,44,2,19,15
18060185891682361,17841401871496039,360radioco,"360 Radio Colombia","😂 En video quedó registrado el momento en el que un hombre confundió el “choque las cinco” con la bendición que le estaba dando un Padre durante su matrimonio.",21,"02/23/2026 09:25",https://www.instagram.com/reel/DVG9T3tDo0U/,"Reel de Instagram",,Total,27598,18569,523,456,5,14,42
18139793638436627,17841401871496039,360radioco,"360 Radio Colombia","🟢 En video quedó registrada la celebración de Cristian ‘Chicho’ Arango, tras su primera anotación como jugador de #AtléticoNacional, en su primera titularidad y primero como local. La dedicación fue para su abuela, quien le inculcó el amor por el ‘Verde de la Montaña’.",0,"02/23/2026 08:57",https://www.instagram.com/reel/DVG6FYQDtOW/,"Reel de Instagram",,Total,3254,2434,69,4,1,0,1
18073331687631382,17841401871496039,360radioco,"360 Radio Colombia","🚨 Urgente: Parex Resources anunció que presentó una propuesta formal para adquirir el negocio upstream en Colombia de Frontera Energy Corp. por US$500 millones en efectivo, más la asunción de deuda y un pago contingente de US$25 millones bajo términos similares a los ya anunciados previamente.

La oferta representa una prima de US$125 millones frente al acuerdo existente y, según la compañía, ofrecería un mayor valor inmediato a los accionistas de Frontera.

Imad Mohsen, presidente y CEO de Parex, aseguró que la propuesta en efectivo podría ser considerada como una “oferta superior” por parte de la junta directiva de Frontera, y manifestó su interés en avanzar en conversaciones para concretar la transacción.

#Empresas #Economía",0,"02/23/2026 07:00",https://www.instagram.com/p/DVGspyCjkIO/,"Imagen de Instagram",,Total,1048,631,10,2,0,0,0
18127488511479551,17841401871496039,360radioco,"360 Radio Colombia","#Empresas | 💼🇨🇴 La presencia de empresarios colombianos entre las mayores fortunas de América Latina vuelve a poner al país en el radar de los grandes mercados regionales. Más allá de los montos, este listado refleja el peso que hoy tienen los negocios creados desde Colombia en sectores estratégicos de la economía 🌎.

📊✨ La gráfica muestra cómo el capital latinoamericano sigue concentrándose en líderes con fuerte capacidad de expansión internacional, diversificación y visión de largo plazo. Para el ecosistema empresarial, es una señal clara de que competir en grande desde la región sí es posible 🚀.

💡📈 En un momento de alta incertidumbre económica, estos nombres también evidencian el papel de la inversión, la innovación y la gestión empresarial como motores clave para el crecimiento y la proyección global de Colombia.",0,"02/22/2026 09:00",https://www.instagram.com/p/DVEVqO-CCfT/,"Imagen de Instagram",,Total,29754,16801,305,21,6,1,41
17915802984276685,17841401871496039,360radioco,"360 Radio Colombia","🥺 Este es el tráiler de #ToyStory 5.",0,"02/22/2026 05:36",https://www.instagram.com/reel/DVD-Q4ejkcF/,"Reel de Instagram",,Total,2233,1862,67,14,0,0,0
18089243047889406,17841401871496039,360radioco,"360 Radio Colombia","🥺 el Zoológico de Ichikawa, un mono llamado Punch —nacido el 26 de julio de 2025 y cuidado por el personal tras ser abandonado— ha desarrollado un apego especial a un peluche de orangután que no suelta en ningún momento.",0,"02/22/2026 04:54",https://www.instagram.com/reel/DVD5cFdjiLi/,"Reel de Instagram",,Total,4039,3036,64,2,0,0,4
17917706865269724,17841401871496039,360radioco,"360 Radio Colombia","😳 En video quedó registrada la entrevista del activista político Daniel Maldonado a un manifestante en la Plaza de Bolívar. Tras una notoria contrariedad en la ideología política, el entrevistado terminó tirándole el micrófono al piso al entrevistador, quien se estaba refiriendo, además, al sobrepeso del manifestante.",0,"02/22/2026 04:49",https://www.instagram.com/reel/DVD44BrDozv/,"Reel de Instagram",,Total,15489,9302,309,8,1,48,19
17991350288765154,17841401871496039,360radioco,"360 Radio Colombia","🥺 “No me vayan a llorar”, #WillieColón, durante una entrevista en Miami en 2021.",11,"02/21/2026 19:44",https://www.instagram.com/reel/DVC6dWFjh9a/,"Reel de Instagram",,Total,4323,3423,119,5,1,1,2
17968437318011185,17841401871496039,360radioco,"360 Radio Colombia","🕊️ Muere a los 75 años de edad #WillieColón, compositor de canciones como Pedro Navaja, éxito del álbum Siembra, el disco más vendido en la historia de la salsa.",0,"02/21/2026 19:21",https://www.instagram.com/reel/DVC38ogDqhB/,"Reel de Instagram",,Total,3625,2912,226,9,0,3,10
17974194248974504,17841401871496039,360radioco,"360 Radio Colombia","🕊️ 47 años de este momento: #WillieColón, cantando ‘Sin Poderte Hablar’, acompañado por Fania All-Star y la sección de cuerdas de la Orquesta Sinfónica de Venezuela. Presentación transmitida en vivo por RCTV, canal 2, en el programa musical ‘A Todo Color’, conducido por Orlando Urdaneta. Según algunas fuentes, la transmisión corresponde al 20 de octubre de 1979, en antesala al concierto de Las Estrellas de Fania en el Poliedro de Caracas y previo al cumpleaños de Celia Cruz.",0,"02/21/2026 18:45",https://www.instagram.com/reel/DVCzu_ZDjdm/,"Reel de Instagram",,Total,2273,1691,105,3,0,0,10
18142026118474796,17841401871496039,360radioco,"360 Radio Colombia","🕊️ El mensaje de #BadBunny a #WillieColón, después de su fallecimiento.",0,"02/21/2026 18:27",https://www.instagram.com/reel/DVCxyWajmBE/,"Reel de Instagram",,Total,3708,2792,92,2,2,0,2
18062333330659885,17841401871496039,360radioco,"360 Radio Colombia","🕊️ “Vamos a bailar la murga”, #WillieColón",0,"02/21/2026 17:51",https://www.instagram.com/reel/DVCtqyejrtT/,"Reel de Instagram",,Total,3664,2634,210,10,0,4,7
17938531371152303,17841401871496039,360radioco,"360 Radio Colombia","#Tecnología | 📺🌍 El mapa del mercado global de televisores deja un mensaje claro: la competencia es cada vez más intensa y el liderazgo se gana con innovación, escala y visión tecnológica. Hoy, las marcas que marcan la diferencia no solo venden pantallas, construyen experiencias para un consumidor más digital y exigente 🚀.

🔍✨ Esta gráfica refleja un pulso global donde Asia concentra gran parte del protagonismo, mientras otros fabricantes buscan abrirse espacio con propuestas más especializadas y mayor valor agregado. El reto ya no es solo crecer, sino mantenerse relevante en un mercado que cambia al ritmo del streaming, la conectividad y la inteligencia artificial.

📊🔥 Para la industria, los inversionistas y los consumidores, este escenario confirma que el futuro del entretenimiento en casa se está definiendo ahora. Entender quién domina hoy el mercado es clave para anticipar las próximas jugadas de un sector que no deja de transformarse.",0,"02/21/2026 14:00",https://www.instagram.com/p/DVCTNz8ARly/,"Imagen de Instagram",,Total,6845,3996,102,15,9,0,28
18106236598702125,17841401871496039,360radioco,"360 Radio Colombia","🎺 “Todo tiene su final”, #WILLIECOLÓN",0,"02/21/2026 13:27",https://www.instagram.com/reel/DVCPXOvDpaY/,"Reel de Instagram",,Total,5077,4196,274,27,7,3,13
18308037061259308,17841401871496039,360radioco,"360 Radio Colombia","🇺🇸 #WILLIECOLÓN (1950-2026)",0,"02/21/2026 10:31",https://www.instagram.com/reel/DVB6tY0juM8/,"Reel de Instagram",,Total,45197,37793,2963,451,41,69,161
18096285376754895,17841401871496039,360radioco,"360 Radio Colombia","🇨🇴 A propósito de la Consulta Presidencial del próximo 8 de marzo, ciudadanos cuentan si participarán o no, y por quién van a votar.",88,"02/21/2026 09:00",https://www.instagram.com/reel/DVBw2VZkv5Y/,"Reel de Instagram",,Total,2616,2310,48,1,0,5,1
18097915159745609,17841401871496039,360radioco,"360 Radio Colombia","#Mundo l 🎓 ¿Sabías que Oxford encabeza el ranking de las mejores universidades del mundo para 2026, seguida por Yale y Stanford?  Este top 10 incluye instituciones icónicas como MIT, Harvard, Cambridge, Imperial College, Michigan y la Universidad de Pensilvania.  Un verdadero mapa de los sueños para quienes quieren estudiar en la élite global. 

🌍 Detrás de este listado está un análisis de 500 universidades realizado por TIME y Statista, que evalúa investigación, impacto, internacionalización y empleabilidad. Reino Unido y Estados Unidos dominan los primeros puestos, confirmando su peso en la educación superior mundial.Pero cada vez más universidades de otras regiones están escalando posiciones. 

📚 Si pudieras elegir, ¿en cuál de estas universidades te gustaría estudiar: Oxford, Yale, Stanford, MIT u otra del top?  Cuéntame en los comentarios qué carrera te imaginas cursando allí y etiqueta a esa persona con la que compartirías este sueño académico.",0,"02/21/2026 05:00",https://www.instagram.com/p/DVBVaeJgeYf/,"Imagen de Instagram",,Total,80462,41547,962,212,34,3,250
17998053509899421,17841401871496039,360radioco,"360 Radio Colombia","En un país marcado por antecedentes de irregularidades electorales, cualquier señalamiento sobre fraude tiene un efecto inmediato en la confianza pública.",0,"02/20/2026 16:00",https://www.instagram.com/p/DU_8JsNjDZB/,"Secuencia de Instagram",,Total,1105,473,10,0,0,0,1
17919930591257203,17841401871496039,360radioco,"360 Radio Colombia","✈️ El Ministerio de #Transporte y la Aeronáutica Civil revelaron el informe preliminar sobre el trágico accidente del avión de Satena ocurrido el 28 de enero, que dejó 15 personas fallecidas en el departamento de Norte de Santander.

La aeronave cubría la ruta Cúcuta–Ocaña cuando perdió contacto con la torre de control a 15 millas náuticas de su destino. Minutos después, los sistemas registraron un descenso continuo antes de impactar contra una zona montañosa en el sector de Las Guamas, jurisdicción de La Playa de Belén.

Las cajas negras fueron recuperadas y ya se adelantan análisis técnicos, incluso con apoyo internacional bajo estándares de la OACI, para esclarecer las causas de esta tragedia aérea en #Colombia.",113,"02/20/2026 13:50",https://www.instagram.com/reel/DU_tRVHjgE6/,"Reel de Instagram",,Total,10198,6882,78,6,0,0,16
18067924862247202,17841401871496039,360radioco,"360 Radio Colombia","El sistema financiero en 2025 dejó un nuevo podio 💰📊

La Superintendencia Financiera de Colombia reveló que Bancolombia lideró en utilidades con $6,3 billones, pero la gran sorpresa fue Banco GNB Sudameris Colombia, que por primera vez se quedó con el segundo lugar ($1,85 billones), desplazando a Banco Davivienda al tercer puesto.

Top 5 en ganancias 2025:

 🥇 Bancolombia – $6,3 billones

 🥈 Banco GNB Sudameris – $1,85 billones

 🥉 Davivienda – $1,83 billones

 4️⃣ Banco de Bogotá – $1,2 billones

 5️⃣ Citibank – $643.617 millones

#Economía #Bancos #Colombia",0,"02/20/2026 13:08",https://www.instagram.com/p/DU_obgBFlJb/,"Imagen de Instagram",,Total,81489,48802,776,111,60,6,115
17947463810965727,17841401871496039,360radioco,"360 Radio Colombia","“La prioridad que tenemos es el plan democracia. Garantizar que estas elecciones sean totalmente seguras”.

Ministro de Defensa, Pedro Arnulfo Sánchez, tras reunión con gobernantes en #Córdoba.",80,"02/20/2026 11:30",https://www.instagram.com/reel/DU_dQuTDiFA/,"Reel de Instagram",,Total,1604,1378,12,0,0,8,1
18085263287273449,17841401871496039,360radioco,"360 Radio Colombia","🐔 En video quedó registrado el baile del pollo Frisby, a  propósito de la popularidad del fenómeno #Therian, usuarios indican que este es el que más quieren.",23,"02/20/2026 10:00",https://www.instagram.com/reel/DU_TAR1Dr3w/,"Reel de Instagram",,Total,6207,4626,236,73,0,4,6
18004101098848643,17841401871496039,360radioco,"360 Radio Colombia","🗣️ “Ha tenido la inteligencia y la generosidad de saber que para financiar las energías limpias hay que sacar la riqueza de la tierra, porque si no lo hago nos quedamos sin petróleo y sin energías limpias y empleo para las familias petroleras”.

#RoyBarreras, candidato presidencial, sobre el apoyo de la USO para la consulta presidencial del 8 de marzo.",50,"02/20/2026 09:30",https://www.instagram.com/reel/DU_Pg-Njujc/,"Reel de Instagram",,Total,601,412,7,0,0,0,0
17855875239665532,17841401871496039,360radioco,"360 Radio Colombia","🗣️ “La #UniversidadNacional debe ser un espacio de crítica constante, donde se escuchen los consensos y disensos”.

Estudiantes de la institución sobre el paro actual.",49,"02/20/2026 09:05",https://www.instagram.com/reel/DU_MuGDjmaa/,"Reel de Instagram",,Total,2768,2161,26,1,0,0,1
17896137024258137,17841401871496039,360radioco,"360 Radio Colombia","🇨🇴 El ministro de Justicia, Jorge Iván Cuervo Restrepo, anunció ante el Congreso que sostendrá un encuentro con la fiscal general Luz Adriana Camargo para revisar el avance de los procesos y reforzar las acciones investigativas frente a los asesinatos de firmantes del Acuerdo de Paz en #Colombia.",32,"02/20/2026 08:30",https://www.instagram.com/reel/DU_Ipesjqf1/,"Reel de Instagram",,Total,1510,1376,8,0,0,0,0
18066001643636425,17841401871496039,360radioco,"360 Radio Colombia","🚨 Urgente: La Corte Suprema de los Estados Unidos anuló los aranceles globales impuestos por la administración de Donald Trump, al considerar que excedieron su autoridad constitucional.

El fallo redefine los límites del poder presidencial en materia comercial y podría obligar al Gobierno a devolver miles de millones de dólares recaudados.",0,"02/20/2026 07:57",https://www.instagram.com/p/DU_E3rPjr9w/,"Imagen de Instagram",,Total,2813,1520,47,7,0,0,1
18107243188806697,17841401871496039,360radioco,"360 Radio Colombia","🗣️ “Uno casi nunca se lleva bien con la suegra”.

🇨🇴 Armando #Benedetti, Ministro del Interior, confirma que no votará en las consultas presidenciales y opina sobre que su suegra sí lo haga.",50,"02/20/2026 06:30",https://www.instagram.com/reel/DU-646yjp2H/,"Reel de Instagram",,Total,4669,3289,31,5,0,22,1
18309501886285345,17841401871496039,360radioco,"360 Radio Colombia","🗣️ “Como papá, me solidarizo con toda la familia de Kevin. Sé lo que es sufrir porque la medicina no llega. Como Presidente no dejaré que eso pase”.

#DanielQuintero, candidato presidencial.",48,"02/20/2026 06:00",https://www.instagram.com/reel/DU-3hfGjv__/,"Reel de Instagram",,Total,4592,3299,24,1,0,134,2
18164479168405503,17841401871496039,360radioco,"360 Radio Colombia","🗣️ “Que alguien me diga, ¿por qué no nos merecemos un salario de dos millones?”

🇨🇴 Ciudadano que trabaja en recoger las bolsas de basura documenta parte de su trabajo y defiende el alza del Salario Mínimo.",51,"02/20/2026 05:30",https://www.instagram.com/reel/DU-0DA7DqjC/,"Reel de Instagram",,Total,8950,5481,181,8,0,67,9
18083153999215919,17841401871496039,360radioco,"360 Radio Colombia","😧 Multitudinario: así fue el recibimiento al candidato presidencial, Abelardo De La Espriella (@delaespriella_style) en Cúcuta.",52,"02/20/2026 05:00",https://www.instagram.com/reel/DU-wrp6jvEb/,"Reel de Instagram",,Total,8731,6509,1346,102,5,132,11
18339792994214306,17841401871496039,360radioco,"360 Radio Colombia","🗣️ “Hoy la mejor política de prevención en salud en Colombia es no votar por #IvánCepeda y Carolina Corcho quienes son autores y cómplices de un proyecto que tiene sin medicamentos al país y quienes además prometieron continuar con semejante desastre”.

Daniel Briceño, candidato a la Cámara por #Bogotá del #CentroDemocrático.",42,"02/20/2026 04:00",https://www.instagram.com/reel/DU-pxvGDpF_/,"Reel de Instagram",,Total,31385,25493,4302,298,23,167,43
18036750026762045,17841401871496039,360radioco,"360 Radio Colombia","“Desde la década de 1980, la vida de la gente de Medellín y Antioquía cambió. Ya no regresarán al pasado”.

#IvánCepeda, candidato presidencial del #PactoHistórico.",58,"02/20/2026 03:30",https://www.instagram.com/reel/DU-mZDQDogQ/,"Reel de Instagram",,Total,6378,3887,33,0,0,75,0
18046238381732828,17841401871496039,360radioco,"360 Radio Colombia","🗣️ “Señor Gaviria, corrompido es aquel que hizo parte de un gobierno con el único objetivo de sabotear la reforma a la salud y traicionar a la juventud que eligió un programa de cambio”.

Daniel Rojas, Ministro de Educación en #Colombia, a Alejandro Gaviria.",179,"02/20/2026 03:00",https://www.instagram.com/reel/DU-i6yijvqO/,"Reel de Instagram",,Total,2465,1612,16,1,0,6,1
17907093843182810,17841401871496039,360radioco,"360 Radio Colombia","⚖️ El caso disciplinario contra el Manchester City entra en su fase decisiva.
La Premier League presentó más de 100 cargos por presuntas irregularidades financieras entre 2009 y 2018. La investigación nació tras las filtraciones de Football Leaks. Se acusa al club de información financiera inexacta y falta de cooperación.
El fallo se conocería en los próximos meses.

🏆 El proceso ocurre tras años de éxitos deportivos. Desde 2008, con el Abu Dhabi United Group, el club cambió su dimensión. Con Pep Guardiola, ganó múltiples ligas y la Champions en 2023. En 2022/23 reportó ingresos superiores a £700 millones. Ahora el foco está en sus cuentas, no en los títulos.

🚨 Las sanciones pueden ir desde multas hasta deducción de puntos o expulsión.
No existe norma automática que lo envíe a quinta división. Un castigo fuerte podría comprometer su permanencia en la liga. El veredicto lo tomará una comisión independiente, con opción de apelación.Lo que está en juego es el modelo financiero del fútbol inglés.",0,"02/19/2026 11:37",https://www.instagram.com/p/DU85SakkjNK/,"Imagen de Instagram",,Total,2982,1730,23,1,0,0,0
18002795513849033,17841401871496039,360radioco,"360 Radio Colombia","📊 Antioquia cerró 2025 con crecimiento de 2,8%, por encima del 2,6% nacional.
El dato fue respaldado por el Dane y el Centro de Pensamiento de la Universidad EIA. En un año de tensiones políticas y entorno global complejo. El departamento logró mantener un ritmo superior al promedio país. La diferencia: mayor impulso del sector privado.

🏭 La industria creció 4,9%, frente al 1,9% nacional. El comercio minorista aumentó 14,2% en el departamento. Las exportaciones subieron 22,6%, muy por encima del 1,3% nacional. Importaciones de maquinaria crecieron 6,3%, señal de inversión. Empresa privada, comercio y sector externo marcaron la pauta.

🏗️ En vivienda se vendieron 173.632 unidades en el país (+12,4%). El turismo también aportó: 1,2 millones de extranjeros llegaron por el Aeropuerto Internacional José María Córdova, un alza de 11,7%. Hoteles, comercio y servicios sintieron el impacto. Antioquia cerró 2025 con cifras superiores al promedio nacional.",0,"02/19/2026 11:30",https://www.instagram.com/p/DU84hIakmFJ/,"Imagen de Instagram",,Total,1188,640,23,0,0,0,0
18208481830326041,17841401871496039,360radioco,"360 Radio Colombia","💼⚽ La carrera de Jorge Sampaoli no solo se mide en títulos, también en cheques por rescisión. 

💰 En la última década ha acumulado US$21,3 millones en indemnizaciones.
Su salida de la AFA tras Rusia 2018 le dejó cerca de US$1,5 millones.
Desde entonces, los finales anticipados se volvieron parte de su historia.
Despedido… pero bien liquidado. 

El pago más alto llegó en 2023 con el Sevilla FC.
El club español habría desembolsado casi US$9 millones por su salida.
Una cifra que marcó ruido en el mercado europeo.
Cláusulas blindadas y contratos de alto nivel.
Negocio redondo, aun sin proyecto largo.

Su etapa en Atlético Mineiro también terminó antes de tiempo.
Aunque no hay cifra oficial, el acumulado podría subir.
En el fútbol los técnicos duran poco, pero las cláusulas pesan mucho.
Entre éxitos como la Copa América 2015 y ciclos cortos, su carrera ha sido intensa.
Más que trofeos, los números explican su patrimonio.",0,"02/19/2026 06:58",https://www.instagram.com/p/DU8ZYJckh80/,"Imagen de Instagram",,Total,41521,26774,227,68,2,11,16
18084539950973076,17841401871496039,360radioco,"360 Radio Colombia","🚨 “Ayer fue #Kevin la víctima, hoy es Robison, paciente con leucemia y trasplantado. 5 semanas sin tratamiento, es una patrón general en Nueva EPS”.

🥺 Mamá pide ayuda con el medicamento para su hijo.",59,"02/19/2026 06:20",https://www.instagram.com/reel/DU8U_50DsG2/,"Reel de Instagram",,Total,4651,3642,164,16,0,15,2
18171292570382656,17841401871496039,360radioco,"360 Radio Colombia","😧 Así fue el cruce completo entre #Vinicius Junior y Nicolás Otamendi, en el partido de Champions League.",16,"02/19/2026 05:30",https://www.instagram.com/reel/DU8PS78DmU1/,"Reel de Instagram",,Total,9100,4806,164,11,0,7,2
17913266763294968,17841401871496039,360radioco,"360 Radio Colombia","🇨🇴 El presidente @gustavopetrourrego, advirtió durante el consejo de ministros en #Montería que querían atentad contra su físico.

🗣️ “Quieren dañar al presidente físicamente”, dijo el mandatario.",0,"02/10/2026 15:34",https://www.instagram.com/reel/DUmJKDdjtHV/,"Reel de Instagram",,Total,3018,1882,31,9,0,76,5
17933105526175111,17841401871496039,360radioco,"360 Radio Colombia","🚍 La movilidad en la Carrera Décima de #Bogotá presenta afectaciones por manifestaciones que se concentran en este corredor vial, generando cierres intermitentes y congestión en ambos sentidos. La presencia de manifestantes ha obligado a restringir el paso vehicular en varios tramos, especialmente en horas de alta demanda.

🤝 Las protestas han impactado el tránsito de vehículos particulares, transporte público y rutas del SITP, con desvíos preventivos establecidos por las autoridades. Algunos buses han tenido que modificar sus recorridos para evitar la zona, lo que ha provocado retrasos en los desplazamientos habituales de los usuarios.

La Secretaría de Movilidad recomienda evitar la Carrera Décima, tomar rutas alternas y mantenerse informado por los canales oficiales. Agentes de tránsito hacen presencia en el sector mientras se controla la situación y se busca restablecer la circulación con normalidad.",10,"02/10/2026 14:48",https://www.instagram.com/reel/DUmDuCBDk5U/,"Reel de Instagram",,Total,2595,2090,23,1,1,0,0
18083804384266731,17841401871496039,360radioco,"360 Radio Colombia","🤬 “No me dan mis medicamentos, ¿pierdo el órgano que mi esposa me donó?”.
Un ciudadano intentó reclamarle al Ministro de Salud, Guillermo #Jaramillo, por la falta en la entrega de medicamentos. Esto pone en peligro el órgano que su esposa le donó.",41,"02/19/2026 04:00",https://www.instagram.com/reel/DU8FBhEDowv/,"Reel de Instagram",,Total,15378,9314,417,26,3,38,23
17854372578588419,17841401871496039,360radioco,"360 Radio Colombia","🗣️ | “#GustavoPetro es un miserable”.

🇨🇴 Daniel Briceño, candidato a la Cámara de Representantes por Bogotá del partido @cedemocratico.",169,"02/19/2026 03:30",https://www.instagram.com/reel/DU8BkWVDvV3/,"Reel de Instagram",,Total,9498,8481,2203,8,10,73,13
17849091066646580,17841401871496039,360radioco,"360 Radio Colombia","🐶 Un perro atacó a un ‘Therian’ que se reconoce como gata.",10,"02/19/2026 03:00",https://www.instagram.com/reel/DU7-FhXjvGR/,"Reel de Instagram",,Total,40105,17658,784,430,3,102,43
17888417784434294,17841401871496039,360radioco,"360 Radio Colombia","⛪️ “Hoy, Miércoles de Ceniza, comenzamos la Cuaresma, tiempo de gracia y conversión. Pidamos al Señor que disponga nuestros corazones para escuchar y hacer vida su Palabra, ayunando de gestos y comentarios que hieran a los demás y nos alejen de su Corazón misericordioso. Que Dios los bendiga. Muchas gracias”.

#PapaLeónXIV",0,"02/18/2026 20:59",https://www.instagram.com/reel/DU7UgcmDuK8/,"Reel de Instagram",,Total,1089,958,18,0,0,0,0
18122272567588530,17841401871496039,360radioco,"360 Radio Colombia","🤝 En video quedó registrado el momento de la reconciliación entre los cantantes de música urbana, Rauw Alejandro y Jhay Cortés.",0,"02/18/2026 20:51",https://www.instagram.com/reel/DU7TfLOjmED/,"Reel de Instagram",,Total,1799,1071,13,0,1,0,0
18071067515638936,17841401871496039,360radioco,"360 Radio Colombia","🗣️ “Nos estamos volviendo viejos antes de volvernos ricos” 

🤝 #PalomaValencia en debate de candidatos organizado por la #UEIA",39,"02/18/2026 15:58",https://www.instagram.com/reel/DU6yKiHDnRu/,"Reel de Instagram",,Total,4564,3023,83,1,0,4,0
